{
  "schema_version": 1,
  "id": "00000000-0000-4000-8000-000000000400",
  "parish": {
    "id": "00000000-0000-4000-8000-000000000401",
    "name": "St. Joseph Parish"
  },
  "created_at": "2026-08-24T19:30:00Z",
  "database": {
    "path": "database/ordo.sqlite",
    "sha256": "9f585a4046797e020175f9a1cb8544b75583954c5fa0782e643d01a42c58ba91",
    "size": 8192,
    "schema_version": 3
  },
  "assets": [],
  "assets_fingerprint": "8937042463a984e16c3fec80b7a9924e7b737f2e3903f51bd484833dd1a8b6a7"
}
